{
  "$schema": "https://json-schema.org/draft/2020-12/schema",
  "$id": "https://qory.dev/contracts/forager/v1/link-run-answer.schema.json",
  "title": "Link run answer",
  "description": "What a gateway returns on its link to a run request it accepts, a 200, application/json: on the local link unsigned, the socket's peer authenticated by its uid; behind a separate gateway signed under a key the run key names, over the connection and the request (README §The gateway's link). The run id echoed, the policy in force for the run and its digest, the run's variables, the variables the agent sees in place of credentials and tools' secrets, the names of the variables the machine's credentials are read from, the hosts and placeholders of each credential the gateway holds, with the auth and key_form of a credential from the server, the run's image when it has a wall, the policy_applied members the gateway decides, on the local link the run's labels and proxy secret, and the run's certificate authority when the run request's wall is true and the gateway reads inside HTTPS for the run. A member Forager does not recognise is ignored.",
  "type": "object",
  "additionalProperties": true,
  "required": ["version", "run_id", "applied"],
  "dependentRequired": {
    "policy": ["digest"],
    "digest": ["policy"]
  },
  "properties": {
    "version": {
      "description": "The document format. Forager refuses a version it does not read.",
      "const": 1
    },
    "run_id": {
      "description": "The run id of the request, echoed.",
      "$ref": "link-run-request.schema.json#/properties/run_id"
    },
    "labels": {
      "description": "The run's labels as the gateway holds them, the run request's: on the local link, where the session's dev.qory.run.started contains exactly these. Behind a separate gateway the labels are the run's registration's, and the answer has none.",
      "$ref": "events/run.started.schema.json#/properties/labels"
    },
    "policy": {
      "description": "The policy in force for the run: the one the gateway holds for it, narrowed by the request's narrowing when it has one. Absent when there is none, and the gateway observes everything.",
      "$ref": "policy.schema.json"
    },
    "digest": {
      "description": "sha256 of the policy as canonical JSON, hex: the digest dev.qory.run.policy_applied reports for it.",
      "$ref": "events/run.policy_applied.schema.json#/properties/digest"
    },
    "variables": {
      "description": "The variables the agent's process receives, as a run configuration contains them.",
      "$ref": "run-configuration.schema.json#/properties/variables"
    },
    "placeholders": {
      "description": "The variables the agent sees in place of a credential or a tool's secret the gateway holds: the session sets each to a value that is no credential, and the run passes no value for one, placeholder_conflict. Names alone, never a value. Absent means none.",
      "type": "array",
      "items": {"type": "string", "pattern": "^[A-Za-z_][A-Za-z0-9_]{0,127}$"}
    },
    "reserved": {
      "description": "The names of the variables the machine's credentials are read from: a walled run that passes one is refused with variable_reserved, and an unwalled run has its value left out. Absent means none.",
      "type": "array",
      "items": {"type": "string", "pattern": "^[A-Za-z_][A-Za-z0-9_]{0,127}$"}
    },
    "credential_hosts": {
      "description": "The hosts and placeholders of each credential the gateway holds for the run, so the session can tell which hosts the run's credentials cover: one entry per credential, in the order the policy selects them. Names and hosts alone, never a secret. Absent means none.",
      "type": "array",
      "items": {
        "type": "object",
        "additionalProperties": false,
        "required": ["name", "hosts", "placeholders"],
        "properties": {
          "name": {"description": "The credential's name, as the policy selects it.", "$ref": "policy.schema.json#/properties/credentials/items/properties/name"},
          "hosts": {
            "description": "The credential's hosts as the proxy matches them: the hosts applied.credentials lists for the credential, in its order.",
            "type": "array",
            "minItems": 1,
            "items": {"$ref": "events/run.policy_applied.schema.json#/properties/credentials/items/properties/hosts/items"}
          },
          "placeholders": {
            "description": "The variables the session sets to a value that is no credential for this credential, each also in placeholders. Empty when the credential sets none. The variable key_form chooses may be among them, when the server's entry lists it; when it is not, the session adds it.",
            "type": "array",
            "uniqueItems": true,
            "items": {"$ref": "#/properties/placeholders/items"}
          },
          "auth": {"description": "How the proxy sets the value of a credential from the server, its run configuration entry's auth. Absent for a credential of the machine's.", "$ref": "auth.schema.json"},
          "key_form": {"description": "The form of the key of a credential from the server whose run configuration entry has key_form. The session chooses the variable the credential's placeholder goes into by it and auth.scheme, from the run's runtime's descriptor, and refuses a run whose runtime has no such variable, run_configuration_invalid. Absent for every other credential.", "$ref": "run-configuration.schema.json#/$defs/key_form"}
        },
        "dependentRequired": {"key_form": ["auth"]}
      }
    },
    "image": {
      "description": "The image the run gets, the one the policy in force selects or the machine's default, resolved against the run request's images: present when the run request's wall is true. Its reference may carry a registry's credentials in its user information: never logged or reported.",
      "$ref": "link-run-request.schema.json#/$defs/image"
    },
    "relay_image": {
      "description": "The reference of the machine's default image, which the wall starts the run's relay from whatever image the run gets: present when the run request's wall is true and its images have a default. The session decides none of it again. Its reference may carry a registry's credentials in its user information: never logged or reported.",
      "type": "string",
      "minLength": 1
    },
    "applied": {
      "description": "The members of dev.qory.run.policy_applied the gateway decides for the policy in force: every member but variables, credential_variables and harness_hosts, each present exactly when the gateway's is. The session's dev.qory.run.policy_applied is this object with the session's variables, credential_variables and harness_hosts added.",
      "type": "object",
      "additionalProperties": false,
      "required": ["mode", "allow", "source"],
      "allOf": [{"$ref": "events/run.policy_applied.schema.json#/allOf/0"}, {"$ref": "events/run.policy_applied.schema.json#/allOf/1"}, {"$ref": "events/run.policy_applied.schema.json#/allOf/2"}, {"$ref": "events/run.policy_applied.schema.json#/allOf/3"}, {"$ref": "events/run.policy_applied.schema.json#/allOf/4"}],
      "properties": {
        "mode": {"$ref": "events/run.policy_applied.schema.json#/properties/mode"},
        "allow": {"$ref": "events/run.policy_applied.schema.json#/properties/allow"},
        "deny": {"$ref": "events/run.policy_applied.schema.json#/properties/deny"},
        "source": {"$ref": "events/run.policy_applied.schema.json#/properties/source"},
        "url": {"$ref": "events/run.policy_applied.schema.json#/properties/url"},
        "digest": {"$ref": "events/run.policy_applied.schema.json#/properties/digest"},
        "run_configuration": {"$ref": "events/run.policy_applied.schema.json#/properties/run_configuration"},
        "paths": {"$ref": "events/run.policy_applied.schema.json#/properties/paths"},
        "credentials": {"$ref": "events/run.policy_applied.schema.json#/properties/credentials"},
        "tools": {"$ref": "events/run.policy_applied.schema.json#/properties/tools"},
        "image": {"$ref": "events/run.policy_applied.schema.json#/properties/image"},
        "terminated": {"$ref": "events/run.policy_applied.schema.json#/properties/terminated"},
        "node_policy": {"$ref": "events/run.policy_applied.schema.json#/properties/node_policy"},
        "ceiling_paths": {"$ref": "events/run.policy_applied.schema.json#/properties/ceiling_paths"}
      }
    },
    "proxy_secret": {
      "description": "The run's proxy secret: at least 128 bits from the system's random source, made by the gateway for this run. It opens every connection to the gateway's proxy on loopback, in the relay's preamble: behind a wall the wall's relay writes it, and without one the session's forwarder writes it before what the agent sends. It is in no agent's environment. Compared in constant time, never logged, refused once its run ends; it never leaves the machine. Characters the relay's preamble carries as they are. On the local link alone: behind a separate gateway the answer has none, since the run key opens the proxy's connections.",
      "type": "string",
      "pattern": "^[A-Za-z0-9_-]{22,256}$"
    },
    "certificate_authority": {
      "description": "The certificate of the run's certificate authority, PEM: present when the run request's wall is true and the gateway reads inside HTTPS for the run, for a credential it holds, a tool it starts or a path rule, the policy's or the node's, and behind a wall with a server always, since a reload may bring path rules or credentials; absent otherwise, and always when wall is false. The certificate the enclosure trusts after the image's authorities; never its key, which stays with the gateway.",
      "type": "string",
      "maxLength": 16384,
      "pattern": "^-----BEGIN CERTIFICATE-----\\r?\\n[A-Za-z0-9+/=\\r\\n]+-----END CERTIFICATE-----\\r?\\n?$"
    }
  }
}
