{
  "version": 1,
  "run_id": "0192f0c1-7d4e-7a2b-8c3d-4e5f6a7b8c9d",
  "labels": {
    "forge": "example-forge",
    "repository": "example-namespace/project"
  },
  "applied": {
    "mode": "observe",
    "allow": [],
    "source": "none"
  },
  "proxy_secret": "fixture-proxy-secret-0000000000000000000002"
}
