{
  "version": 1,
  "run_id": "0192f0c1-7d4e-7a2b-8c3d-4e5f6a7b8c9d",
  "policy": {
    "version": 1,
    "egress": {
      "mode": "enforce",
      "allow": [
        "api.example"
      ]
    }
  },
  "digest": "0083089af881510432ef44e416ccef8c5e84f33678e1de98411520b97f277c78",
  "applied": {
    "mode": "enforce",
    "allow": [
      "api.example"
    ],
    "source": "config",
    "digest": "0083089af881510432ef44e416ccef8c5e84f33678e1de98411520b97f277c78"
  }
}
