{
  "version": 1,
  "run_id": "0192f0c1-7d4e-7a2b-8c3d-4e5f6a7b8c9d",
  "policy": {
    "version": 1,
    "egress": {
      "mode": "enforce",
      "allow": [
        "api.example"
      ]
    }
  },
  "digest": "7f2a3c0f1e1f5b8b1a3c3a51f8f6d6d1f8a0e2c3a0f4f2f3a2e0a1b9c8d7e6f5",
  "applied": {
    "mode": "enforce",
    "allow": [
      "api.example"
    ],
    "deny": [],
    "source": "fetched",
    "url": "https://apiary.example/v1/runs",
    "digest": "7f2a3c0f1e1f5b8b1a3c3a51f8f6d6d1f8a0e2c3a0f4f2f3a2e0a1b9c8d7e6f5",
    "run_configuration": "sha256=2b6c0a5f0e3d7c9b1a8f4e2d6c0b9a7f5e3d1c9b7a5f3e1d9c7b5a3f1e9d7c5b"
  }
}
