{
  "version": 1,
  "run_id": "0192f0c1-7d4e-7a2b-8c3d-4e5f6a7b8c9e",
  "labels": {},
  "policy": {
    "version": 1,
    "egress": {
      "mode": "enforce",
      "allow": [
        "api.anthropic.com"
      ]
    },
    "image": "registry.example/agents/app@sha256:b2b2b2b2b2b2b2b2b2b2b2b2b2b2b2b2b2b2b2b2b2b2b2b2b2b2b2b2b2b2b2b2"
  },
  "digest": "5d5d5d5d5d5d5d5d5d5d5d5d5d5d5d5d5d5d5d5d5d5d5d5d5d5d5d5d5d5d5d5d",
  "image": {
    "ref": "registry.example/agents/app@sha256:b2b2b2b2b2b2b2b2b2b2b2b2b2b2b2b2b2b2b2b2b2b2b2b2b2b2b2b2b2b2b2b2",
    "runtime": "sysbox-runc",
    "reference": true
  },
  "relay_image": "registry.example/agents/base@sha256:4f4f4f4f4f4f4f4f4f4f4f4f4f4f4f4f4f4f4f4f4f4f4f4f4f4f4f4f4f4f4f4f",
  "applied": {
    "mode": "enforce",
    "allow": [
      "api.anthropic.com"
    ],
    "source": "config",
    "digest": "5d5d5d5d5d5d5d5d5d5d5d5d5d5d5d5d5d5d5d5d5d5d5d5d5d5d5d5d5d5d5d5d",
    "image": "registry.example/agents/app@sha256:b2b2b2b2b2b2b2b2b2b2b2b2b2b2b2b2b2b2b2b2b2b2b2b2b2b2b2b2b2b2b2b2"
  },
  "proxy_secret": "fixture-proxy-secret-0000000000000000000000"
}
